[
  {"id": "mano-celestial", "nombre": "Mano Celestial", "tipo": "supertecnica", "categoria": "parada", "elemento": "tierra", "huecos": 1, "potenciaBase": 7, "costeTension": 20, "mejorable": true},
  {"id": "mano-magica", "nombre": "Mano Mágica", "tipo": "supertecnica", "categoria": "parada", "elemento": "tierra", "huecos": 1, "potenciaBase": 10, "costeTension": 20, "mejorable": true},
  {"id": "tornado-de-fuego", "nombre": "Tornado de Fuego", "tipo": "supertecnica", "categoria": "tiro", "elemento": "fuego", "huecos": 1, "potenciaBase": 8, "costeTension": 20, "mejorable": true},
  {"id": "remate-inazuma", "nombre": "Remate Inazuma", "tipo": "hipertecnica", "categoria": "tiro", "elemento": "fuego", "huecos": 2, "potenciaBase": 14, "costeTension": 40, "mejorable": true, "requiereCompanero": ["mark-evans", "jude-sharp"]},
  {"id": "despertar", "nombre": "Despertar", "tipo": "transformacion-basica", "categoria": "estado", "elemento": "neutro", "huecos": 1, "mejorable": false}
]
